{
  "game_type": "5_35",
  "game_name_vi": "Lotto 5/35",
  "analysis_time": "2026-09-24 22:51:01",
  "historical_draws": 796,
  "date_range": {
    "first": "2025-06-29 21:00:00",
    "last": "2026-09-24 13:00:00"
  },
  "latest_draw_number": "00905",
  "statistics": {
    "frequency": {
      "1": 108,
      "2": 99,
      "3": 104,
      "4": 94,
      "5": 81,
      "6": 96,
      "7": 114,
      "8": 110,
      "9": 106,
      "10": 116,
      "11": 119,
      "12": 90,
      "13": 124,
      "14": 125,
      "15": 132,
      "16": 101,
      "17": 108,
      "18": 118,
      "19": 130,
      "20": 125,
      "21": 113,
      "22": 136,
      "23": 125,
      "24": 106,
      "25": 116,
      "26": 120,
      "27": 122,
      "28": 132,
      "29": 113,
      "30": 116,
      "31": 105,
      "32": 105,
      "33": 127,
      "34": 136,
      "35": 108
    },
    "recent_frequency": {
      "10": {
        "6": 1,
        "7": 1,
        "11": 3,
        "19": 2,
        "31": 3,
        "10": 2,
        "14": 2,
        "22": 1,
        "27": 3,
        "34": 2,
        "3": 3,
        "8": 3,
        "9": 2,
        "29": 1,
        "2": 1,
        "13": 1,
        "21": 2,
        "30": 3,
        "15": 1,
        "20": 2,
        "35": 1,
        "18": 1,
        "23": 1,
        "28": 1,
        "33": 1,
        "12": 1,
        "25": 1,
        "24": 1,
        "32": 2,
        "4": 1
      },
      "20": {
        "7": 2,
        "9": 3,
        "16": 3,
        "19": 7,
        "27": 7,
        "6": 4,
        "10": 4,
        "15": 4,
        "22": 4,
        "28": 3,
        "33": 3,
        "35": 5,
        "1": 1,
        "8": 4,
        "13": 2,
        "29": 2,
        "25": 3,
        "30": 6,
        "31": 5,
        "5": 1,
        "2": 3,
        "14": 3,
        "18": 2,
        "24": 2,
        "11": 3,
        "34": 2,
        "3": 3,
        "21": 2,
        "20": 2,
        "23": 1,
        "12": 1,
        "32": 2,
        "4": 1
      },
      "50": {
        "2": 7,
        "26": 5,
        "27": 17,
        "32": 7,
        "34": 7,
        "6": 9,
        "7": 10,
        "12": 5,
        "18": 9,
        "20": 9,
        "4": 8,
        "21": 4,
        "28": 6,
        "13": 10,
        "15": 10,
        "17": 5,
        "30": 9,
        "11": 9,
        "1": 3,
        "5": 3,
        "25": 6,
        "9": 8,
        "3": 5,
        "22": 10,
        "29": 5,
        "23": 7,
        "24": 5,
        "19": 10,
        "31": 6,
        "16": 9,
        "35": 7,
        "10": 6,
        "14": 4,
        "33": 4,
        "8": 6
      },
      "100": {
        "2": 16,
        "21": 16,
        "27": 19,
        "28": 17,
        "33": 15,
        "15": 20,
        "17": 12,
        "29": 11,
        "5": 5,
        "8": 14,
        "13": 23,
        "32": 12,
        "34": 15,
        "6": 15,
        "9": 18,
        "20": 15,
        "23": 16,
        "11": 15,
        "18": 14,
        "26": 10,
        "31": 11,
        "12": 12,
        "25": 11,
        "14": 9,
        "19": 19,
        "7": 16,
        "24": 10,
        "10": 13,
        "16": 16,
        "4": 11,
        "22": 19,
        "3": 16,
        "30": 17,
        "35": 13,
        "1": 9
      },
      "300": {
        "3": 37,
        "9": 39,
        "15": 63,
        "19": 53,
        "31": 43,
        "18": 46,
        "24": 39,
        "27": 49,
        "6": 39,
        "10": 47,
        "11": 42,
        "25": 37,
        "13": 50,
        "14": 32,
        "26": 46,
        "29": 41,
        "16": 39,
        "33": 51,
        "34": 58,
        "17": 45,
        "22": 57,
        "28": 49,
        "21": 44,
        "1": 34,
        "8": 39,
        "12": 35,
        "20": 47,
        "32": 35,
        "30": 35,
        "35": 43,
        "7": 38,
        "23": 44,
        "5": 28,
        "4": 39,
        "2": 37
      }
    },
    "hot_numbers": [
      22,
      34,
      15,
      28,
      19,
      33,
      14,
      20,
      23,
      13
    ],
    "cold_numbers": [
      5,
      12,
      4,
      6,
      2,
      16,
      3,
      31,
      32,
      9
    ],
    "normalized_frequency": {
      "1": 0.794118,
      "2": 0.727941,
      "3": 0.764706,
      "4": 0.691176,
      "5": 0.595588,
      "6": 0.705882,
      "7": 0.838235,
      "8": 0.808824,
      "9": 0.779412,
      "10": 0.852941,
      "11": 0.875,
      "12": 0.661765,
      "13": 0.911765,
      "14": 0.919118,
      "15": 0.970588,
      "16": 0.742647,
      "17": 0.794118,
      "18": 0.867647,
      "19": 0.955882,
      "20": 0.919118,
      "21": 0.830882,
      "22": 1.0,
      "23": 0.919118,
      "24": 0.779412,
      "25": 0.852941,
      "26": 0.882353,
      "27": 0.897059,
      "28": 0.970588,
      "29": 0.830882,
      "30": 0.852941,
      "31": 0.772059,
      "32": 0.772059,
      "33": 0.933824,
      "34": 1.0,
      "35": 0.794118
    },
    "frequency_trend": {
      "1": 0.0,
      "2": 0.0,
      "3": 0.0,
      "4": 0.0,
      "5": 0.0,
      "6": 0.0,
      "7": 0.0,
      "8": 0.0,
      "9": 0.0,
      "10": 0.0,
      "11": 0.0,
      "12": 0.0,
      "13": 0.0,
      "14": 0.0,
      "15": 0.0,
      "16": 0.0,
      "17": 0.0,
      "18": 0.0,
      "19": 0.0,
      "20": 0.0,
      "21": 0.0,
      "22": 0.0,
      "23": 0.0,
      "24": 0.0,
      "25": 0.0,
      "26": 0.0,
      "27": 0.0,
      "28": 0.0,
      "29": 0.0,
      "30": 0.0,
      "31": 0.0,
      "32": 0.0,
      "33": 0.0,
      "34": 0.0,
      "35": 0.0
    },
    "gap": {
      "1": {
        "current": 16,
        "average": 7.2617,
        "minimum": 1,
        "maximum": 49,
        "appearances": 108,
        "normalized": 0.020101
      },
      "2": {
        "current": 6,
        "average": 8.0408,
        "minimum": 1,
        "maximum": 37,
        "appearances": 99,
        "normalized": 0.007538
      },
      "3": {
        "current": 2,
        "average": 7.6214,
        "minimum": 1,
        "maximum": 31,
        "appearances": 104,
        "normalized": 0.002513
      },
      "4": {
        "current": 0,
        "average": 8.2581,
        "minimum": 1,
        "maximum": 37,
        "appearances": 94,
        "normalized": 0.0
      },
      "5": {
        "current": 13,
        "average": 9.725,
        "minimum": 1,
        "maximum": 40,
        "appearances": 81,
        "normalized": 0.016332
      },
      "6": {
        "current": 9,
        "average": 8.2737,
        "minimum": 1,
        "maximum": 55,
        "appearances": 96,
        "normalized": 0.011307
      },
      "7": {
        "current": 9,
        "average": 6.885,
        "minimum": 1,
        "maximum": 42,
        "appearances": 114,
        "normalized": 0.011307
      },
      "8": {
        "current": 0,
        "average": 7.2844,
        "minimum": 1,
        "maximum": 29,
        "appearances": 110,
        "normalized": 0.0
      },
      "9": {
        "current": 1,
        "average": 7.419,
        "minimum": 1,
        "maximum": 36,
        "appearances": 106,
        "normalized": 0.001256
      },
      "10": {
        "current": 5,
        "average": 6.8087,
        "minimum": 1,
        "maximum": 26,
        "appearances": 116,
        "normalized": 0.006281
      },
      "11": {
        "current": 1,
        "average": 6.6441,
        "minimum": 1,
        "maximum": 44,
        "appearances": 119,
        "normalized": 0.001256
      },
      "12": {
        "current": 3,
        "average": 8.8989,
        "minimum": 1,
        "maximum": 40,
        "appearances": 90,
        "normalized": 0.003769
      },
      "13": {
        "current": 6,
        "average": 6.3984,
        "minimum": 1,
        "maximum": 26,
        "appearances": 124,
        "normalized": 0.007538
      },
      "14": {
        "current": 1,
        "average": 6.4032,
        "minimum": 1,
        "maximum": 30,
        "appearances": 125,
        "normalized": 0.001256
      },
      "15": {
        "current": 5,
        "average": 5.9313,
        "minimum": 1,
        "maximum": 30,
        "appearances": 132,
        "normalized": 0.006281
      },
      "16": {
        "current": 12,
        "average": 7.82,
        "minimum": 1,
        "maximum": 48,
        "appearances": 101,
        "normalized": 0.015075
      },
      "17": {
        "current": 20,
        "average": 7.1215,
        "minimum": 1,
        "maximum": 31,
        "appearances": 108,
        "normalized": 0.025126
      },
      "18": {
        "current": 4,
        "average": 6.7607,
        "minimum": 1,
        "maximum": 56,
        "appearances": 118,
        "normalized": 0.005025
      },
      "19": {
        "current": 0,
        "average": 6.093,
        "minimum": 1,
        "maximum": 30,
        "appearances": 130,
        "normalized": 0.0
      },
      "20": {
        "current": 3,
        "average": 6.3548,
        "minimum": 1,
        "maximum": 25,
        "appearances": 125,
        "normalized": 0.003769
      },
      "21": {
        "current": 4,
        "average": 6.7946,
        "minimum": 1,
        "maximum": 31,
        "appearances": 113,
        "normalized": 0.005025
      },
      "22": {
        "current": 8,
        "average": 5.7407,
        "minimum": 1,
        "maximum": 22,
        "appearances": 136,
        "normalized": 0.01005
      },
      "23": {
        "current": 4,
        "average": 6.371,
        "minimum": 1,
        "maximum": 26,
        "appearances": 125,
        "normalized": 0.005025
      },
      "24": {
        "current": 2,
        "average": 7.5429,
        "minimum": 1,
        "maximum": 32,
        "appearances": 106,
        "normalized": 0.002513
      },
      "25": {
        "current": 3,
        "average": 6.887,
        "minimum": 1,
        "maximum": 29,
        "appearances": 116,
        "normalized": 0.003769
      },
      "26": {
        "current": 25,
        "average": 6.3529,